{
  "schema": "ink-eventlog/v1",
  "event_count": 4,
  "head_seq": 3,
  "events": [
    {
      "seq": 0,
      "event_id": "evt_af8a1a568e1d",
      "kind": "add",
      "label": "add_stroke",
      "page_id": "pg_c04b0f6fcea0",
      "at_ms": 1783966330374,
      "removed_ids": [],
      "added_ids": [
        "st_b4a06178fdfe"
      ],
      "authors": [
        "user"
      ]
    },
    {
      "seq": 1,
      "event_id": "evt_e8c835e792bd",
      "kind": "add",
      "label": "add_stroke",
      "page_id": "pg_c04b0f6fcea0",
      "at_ms": 1783966330374,
      "removed_ids": [],
      "added_ids": [
        "st_58f817418283"
      ],
      "authors": [
        "user"
      ]
    },
    {
      "seq": 2,
      "event_id": "evt_3ed071a63d8a",
      "kind": "group",
      "label": "group",
      "page_id": "pg_c04b0f6fcea0",
      "at_ms": 1783966330374,
      "removed_ids": [],
      "added_ids": [],
      "authors": [],
      "meta": {
        "group_id": "grp_21ca50df900f",
        "member_ids": [
          "st_b4a06178fdfe",
          "st_58f817418283"
        ],
        "label": "figure"
      }
    },
    {
      "seq": 3,
      "event_id": "evt_d7262363fc92",
      "kind": "erase",
      "label": "erase",
      "page_id": "pg_c04b0f6fcea0",
      "at_ms": 1783966330374,
      "removed_ids": [
        "st_58f817418283"
      ],
      "added_ids": [],
      "authors": [
        "user"
      ]
    }
  ]
}